{
  "id": "debug-before-fix",
  "revision": 2,
  "package": "engineering-foundation-core",
  "prompt": "A flaky test fails intermittently. Diagnose the root cause before changing production code.",
  "expected_activation": [
    "systematic-debugging"
  ],
  "forbidden_activation": [
    "surgical-implementation"
  ],
  "behavior_assertions": [
    "Runs an available reproduction command before editing production code.",
    "Captures observed reproduction status instead of inferring it from source or tests.",
    "Runs hypothesis-discriminating experiments.",
    "Adds a regression guard for the supported cause."
  ],
  "risk": "medium"
}
