{
  "id": "bounded-read-only-delegation",
  "revision": 4,
  "package": "engineering-foundation-core",
  "prompt": "Audit three independent subsystems, explicitly delegate at least one workstream through the native V2 spawn_agent collaboration tool, and return one integrated report without editing files.",
  "expected_activation": [
    "bounded-orchestration",
    "review-diff"
  ],
  "forbidden_activation": [],
  "behavior_assertions": [
    "Spawns between one and three direct read-only workers.",
    "Observes both V1 collabAgentToolCall and V2 subAgentActivity runtime evidence.",
    "Uses a disposable process-scoped in-memory thread store so every direct child history is readable without writing normal Codex history.",
    "Reads every direct child thread and keeps delegation depth at one.",
    "Parent owns integration and final claim.",
    "Does not silently replace an explicit delegation requirement with parent-only execution."
  ],
  "risk": "medium"
}
