{
  "id": "design-chooses-one-direction",
  "revision": 1,
  "package": "engineering-foundation-design",
  "prompt": "Redesign this product screen with a professional, coherent visual system.",
  "expected_activation": [
    "design-direction"
  ],
  "forbidden_activation": [],
  "behavior_assertions": [
    "Produces one direction unless alternatives were requested.",
    "Defines hierarchy, tokens, states, accessibility, and performance."
  ],
  "risk": "medium"
}
